{
  "$schema": "https://json-schema.org/draft/2020-12/schema",
  "$id": "https://github.com/Xsamsx/SBOMber/contracts/localisation.schema.json",
  "title": "localisation.json",
  "description": "Candidate vulnerable functions per finding. Produced by component 3, read by component 4. A function changed by a security patch is a CANDIDATE, not a proven culprit — patches routinely bundle refactoring with the fix.",
  "type": "object",
  "required": ["schemaVersion", "scanId", "results"],
  "additionalProperties": false,
  "properties": {
    "schemaVersion": {
      "type": "string",
      "enum": ["1.0.0", "1.1.0"],
      "description": "1.1.0 adds per-candidate evidence, artefact identity and checksums, release tag checks, and the visibility fields of the localisation join rule (docs/design/localisation-join-rule.md). Every 1.1.0 field is optional, so 1.0.0 documents stay valid."
    },
    "scanId": { "type": "string", "description": "Matches canonical-scan.json." },
    "summary": {
      "type": "object",
      "description": "Per-method counts. The unknown rate is a reportable result, not a failure.",
      "additionalProperties": false,
      "properties": {
        "findingsProcessed": { "type": "integer", "minimum": 0 },
        "byMethod": {
          "type": "object",
          "additionalProperties": { "type": "integer", "minimum": 0 }
        },
        "unknownCount": { "type": "integer", "minimum": 0 }
      }
    },
    "results": {
      "type": "array",
      "items": {
        "type": "object",
        "required": ["findingId", "vulnerabilityId", "purl", "method", "confidence"],
        "additionalProperties": false,
        "properties": {
          "findingId": { "type": "string", "description": "From canonical-scan.json." },
          "vulnerabilityId": { "type": "string" },
          "purl": { "type": "string", "pattern": "^pkg:" },
          "method": {
            "type": "string",
            "enum": [
              "advisory_metadata",
              "patch_reference",
              "advisory_text",
              "version_diff",
              "llm_suggested",
              "unknown"
            ],
            "description": "Fallback order, cheapest and most reliable first. unknown is an honest outcome; the finding falls back to package-level treatment."
          },
          "confidence": {
            "type": "string",
            "enum": ["high", "medium", "low", "none"],
            "description": "Categorical, with published criteria. Not a numeric formula."
          },
          "candidateSymbols": {
            "type": "array",
            "description": "A SET, not a single guess. Multi-function patches produce several candidates.",
            "items": {
              "type": "object",
              "required": ["symbol"],
              "additionalProperties": false,
              "properties": {
                "symbol": { "type": "string", "description": "e.g. template, merge, defaultsDeep." },
                "modulePath": { "type": "string", "description": "Path within the package, e.g. lib/template.js." },
                "changeKind": {
                  "type": "string",
                  "enum": ["modified", "added", "removed", "unknown"]
                },
                "note": { "type": "string" },
                "evidence": {
                  "type": "array",
                  "minItems": 1,
                  "items": { "type": "string", "minLength": 1 },
                  "description": "1.1.0. IDs of the artefacts in this result's provenance the candidate was read from. validate.py checks each resolves to a verified artefact with a checksum, of the kind the method reads: patch_reference a source_file, version_diff a tarball, advisory_* the advisory."
                },
                "visibility": {
                  "type": "string",
                  "enum": ["public", "internal", "unknown"],
                  "description": "1.1.0, join rule. public = exported by the package's entry module under this name, or default for the module function itself."
                },
                "exposedVia": {
                  "type": "array",
                  "items": { "type": "string" },
                  "description": "1.1.0, join rule. Public names through which an internal candidate is reached."
                },
                "exposedViaSource": {
                  "type": "string",
                  "enum": ["export_resolution", "advisory_text"],
                  "description": "1.1.0, join rule. Only export_resolution can close a candidate set."
                },
                "exposedViaComplete": {
                  "type": "boolean",
                  "description": "1.1.0, join rule. true only when export resolution was exhaustive."
                }
              }
            }
          },
          "vulnerableVersion": { "type": "string" },
          "fixedVersion": { "type": "string" },
          "provenance": {
            "type": "object",
            "description": "Every candidate must be traceable to its source artefact. From 1.1.0, candidateSymbols[].evidence names the artefacts here.",
            "additionalProperties": false,
            "properties": {
              "advisorySource": { "type": "string", "enum": ["osv", "ghsa", "nvd", "vendor"] },
              "advisoryUrl": { "type": "string" },
              "patchCommit": { "type": "string" },
              "patchUrl": { "type": "string" },
              "artefacts": {
                "type": "array",
                "description": "Downloaded artefacts. Bounded, verified, and NEVER executed.",
                "items": {
                  "type": "object",
                  "required": ["url", "verified"],
                  "additionalProperties": false,
                  "properties": {
                    "id": { "type": "string", "minLength": 1, "description": "1.1.0. Unique within the result; what candidateSymbols[].evidence cites. Derived from the fields: advisory, github:<repo>@<full commit>:<path>, npm:<name>@<version>." },
                    "kind": { "type": "string", "enum": ["advisory", "source_file", "tarball"], "description": "1.1.0. Says how verified was established." },
                    "url": { "type": "string" },
                    "sha256": { "type": "string" },
                    "sizeBytes": { "type": "integer", "minimum": 0 },
                    "verified": {
                      "type": "boolean",
                      "description": "Tag or checksum verified against the published artefact. tarball: bytes match the registry integrity value. source_file: the git blob hash of the bytes read matches the hash GitHub reports for that path at that commit. advisory: the record names the finding's vulnerability and this npm package."
                    },
                    "executed": {
                      "type": "boolean",
                      "const": false,
                      "description": "Always false. Downloaded package code is never executed."
                    },
                    "version": { "type": "string", "description": "1.1.0, tarball. The npm version." },
                    "integrity": { "type": "string", "description": "1.1.0, tarball. The registry's dist.integrity value." },
                    "repo": { "type": "string", "pattern": "^[A-Za-z0-9_.-]+/[A-Za-z0-9_.-]+$", "description": "1.1.0, source_file. owner/name on GitHub." },
                    "commit": { "type": "string", "pattern": "^[0-9a-f]{40}$", "description": "1.1.0, source_file. The commit the file was read at." },
                    "path": { "type": "string", "description": "1.1.0, source_file. Path within the repository." },
                    "gitBlobSha": { "type": "string", "pattern": "^[0-9a-f]{40}$", "description": "1.1.0, source_file. Git blob hash of the bytes read; check with git rev-parse <commit>:<path>." },
                    "modified": { "type": "string", "description": "1.1.0, advisory. The record's own last-modified time; OSV records are edited after publication." },
                    "note": { "type": "string", "description": "1.1.0. Why an artefact is not verified." }
                  }
                }
              },
              "tagChecks": {
                "type": "array",
                "description": "1.1.0, patch_reference. One check per release. The fixed release passes when it carries at least one linked fix commit; the vulnerable release passes when no linked commit is an ancestor of it. An advisory often links commits from several release lines, so the rest are recorded in note. The release commit is npm's gitHead when the registry records one, otherwise the git tag's commit.",
                "items": {
                  "type": "object",
                  "required": ["version", "role", "repo", "fixCommits", "result"],
                  "additionalProperties": false,
                  "properties": {
                    "version": { "type": "string" },
                    "role": { "type": "string", "enum": ["fixed", "vulnerable"] },
                    "repo": { "type": "string" },
                    "fixCommits": { "type": "array", "minItems": 1, "items": { "type": "string", "pattern": "^[0-9a-f]{7,40}$" } },
                    "tag": { "type": "string" },
                    "tagCommit": { "type": "string", "pattern": "^[0-9a-f]{40}$" },
                    "registryGitHead": { "type": "string" },
                    "releaseCommit": { "type": "string" },
                    "releaseSource": {
                      "type": "string",
                      "enum": ["registry_git_head", "git_tag"],
                      "description": "Where releaseCommit came from. A recorded gitHead the repository does not have falls back to the git tag."
                    },
                    "byAncestry": {
                      "type": "array",
                      "items": { "type": "string" },
                      "description": "Linked fix commits that are ancestors of the release. For the vulnerable release any entry is a mismatch."
                    },
                    "byContent": {
                      "type": "array",
                      "items": { "type": "string" },
                      "description": "Fixed release only. Linked commits that are not ancestors (a backport or squash merge) but whose added lines are all in the release's copy of the file."
                    },
                    "content": {
                      "type": "array",
                      "description": "The lines found for the byContent commits, so the check can be re-run.",
                      "items": {
                        "type": "object",
                        "required": ["commit", "path", "lines"],
                        "additionalProperties": false,
                        "properties": {
                          "commit": { "type": "string" },
                          "parent": { "type": "string", "description": "The fix commit's parent. Lines its copy of the file already has are not looked for." },
                          "path": { "type": "string" },
                          "lines": { "type": "array", "items": { "type": "string" } }
                        }
                      }
                    },
                    "basis": {
                      "type": "string",
                      "enum": ["ancestry", "content"],
                      "description": "How a verified result was reached: ancestry when any linked commit is an ancestor, otherwise content."
                    },
                    "result": { "type": "string", "enum": ["verified", "mismatch", "unavailable"] },
                    "note": { "type": "string" }
                  }
                }
              },
              "llm": {
                "type": "object",
                "description": "Present only when method is llm_suggested. Never the sole basis for a negative finding or any VEX statement.",
                "additionalProperties": false,
                "properties": {
                  "provider": { "type": "string" },
                  "model": { "type": "string" },
                  "promptVersion": { "type": "string" },
                  "corroboratedBy": {
                    "type": "string",
                    "enum": ["advisory_metadata", "patch_reference", "version_diff", "none"],
                    "description": "none means this candidate may only raise a finding from unknown; it cannot support a negative conclusion."
                  }
                }
              }
            }
          },
          "excludedChanges": {
            "type": "array",
            "items": { "type": "string", "enum": ["docs", "tests", "ci_config", "build", "formatting"] },
            "description": "Non-code changes excluded from the candidate set."
          },
          "notes": { "type": "string" }
        }
      }
    }
  }
}
